フレーム,"マッチ形式",切札,構築タイプ,デッキ構成方法,試合開始時の切札,デッキ1,デッキ2
エクストラ,"1本勝負",選択,構築,2枚の切札を選択、残り52枚からカードを抜いてもよい,クローズスタート,54枚以下（切札2枚）,-
エクストラ40,"1本勝負",選択,構築,2枚の切札を選択、残り52枚から12枚以上のカードを抜く,クローズスタート,42枚以下（切札2枚）,-
"エクストラ40
選択ランダム","1本勝負",選択,ランダム,2枚の切札を選択、残り52枚からランダムに12枚のカードを抜く,クローズスタート,42枚（切札2枚）,-
エクストラ40ランダムランダム,"1本勝負",ランダム,ランダム,2枚の切札をランダムに選択、残り52枚からランダムに12枚のカードを抜く,クローズスタート,42枚以下（切札2枚）,-
切札4枚構築ハーフ,"3本勝負",選択,構築,4枚の切札（t1、t2、t3、t4）を選択、残り50枚をA・B・Cに分け「t1+t2+A」と「t3+t4+B」をデッキとする（Cは0枚でもよい、Cを抜く）,試合開始時の切札2枚ともクローズ,n枚（切札2枚）,(54-n)枚以下（切札2枚）
切札2枚構築ハーフ,"3本勝負",選択,構築,2枚の切札を選択、残り52枚をA・B・Cに分け「切札+A」と「切札+B」をデッキとする（Cは0枚でもよい、Cを抜く）,段階オープン,n枚（切札2枚）,(56-n)枚以下（切札2枚）
切札選択ランダムハーフ,"3本勝負",選択,ランダム,2枚の切札を選択、残り52枚をランダムにA・Bに分け「切札+A」と「切札+B」をデッキとする（A・Bは26枚ずつでなくてもよい）,段階オープン,n枚（切札2枚）,(56-n)枚（切札2枚）
エクストラランダムハーフ,"3本勝負",ランダム,ランダム,2枚の切札をランダムに選択、残り52枚をランダムにA・Bに分け「切札+A」と「切札+B」をデッキとする（A・Bは26枚ずつでなくてもよい）,段階オープン,n枚（切札2枚）,(56-n)枚（切札2枚）